title,subtitle,price,mainImage,images,description
Dual-Port Bit Driver,Cobalt blue CNC finish,$59,images/1.jpeg,"['images/1.jpeg', 'images/2.jpeg', 'images/3.jpeg', 'images/4.jpeg']","Lorem ipsum dolor sit amet, consectetur adipiscing elit. Sed do eiusmod tempor incididunt ut labore et dolore magna aliqua. Ut enim ad minim veniam, quis nostrud exercitation ullamco laboris nisi ut aliquip ex ea commodo consequat. Duis aute irure dolor in reprehenderit in voluptate velit esse cillum dolore eu fugiat nulla pariatur."
Analog Audio Control Hub,Soft matte with ring LEDs,$79,images/2.jpeg,"['images/2.jpeg']","Excepteur sint occaecat cupidatat non proident, sunt in culpa qui officia deserunt mollit anim id est laborum. Sed ut perspiciatis unde omnis iste natus error sit voluptatem accusantium doloremque laudantium, totam rem aperiam, eaque ipsa quae ab illo inventore veritatis et quasi architecto beatae vitae dicta sunt explicabo."
Laser Range Unit,Black anodized edge + sensor,$110,images/3.jpeg,"['images/3.jpeg']","Nemo enim ipsam voluptatem quia voluptas sit aspernatur aut odit aut fugit, sed quia consequuntur magni dolores eos qui ratione voluptatem sequi nesciunt. Neque porro quisquam est, qui dolorem ipsum quia dolor sit amet, consectetur, adipisci velit."
Smart Object Desk Set,Minimalist modular kit,$129,images/4.jpeg,"['images/4.jpeg']","Sed quia non numquam eius modi tempora incidunt ut labore et dolore magnam aliquam quaerat voluptatem. Ut enim ad minima veniam, quis nostrum exercitationem ullam corporis suscipit laboriosam, nisi ut aliquid ex ea commodi consequatur."
Modular Synth Box,"Magnetic knobs, dual input",$149,images/5.jpeg,"['images/5.jpeg']","Quis autem vel eum iure reprehenderit qui in ea voluptate velit esse quam nihil molestiae consequatur, vel illum qui dolorem eum fugiat quo voluptas nulla pariatur? At vero eos et accusamus et iusto odio dignissimos ducimus qui blanditiis praesentium voluptatum deleniti atque corrupti quos dolores et quas molestias excepturi sint occaecati cupiditate non provident."
Compact Action Camera,"Transparent shell, neon ring",$189,images/6.jpeg,"['images/6.jpeg']","Similique sunt in culpa qui officia deserunt mollitia animi, id est laborum et dolorum fuga. Et harum quidem rerum facilis est et expedita distinctio. Nam libero tempore, cum soluta nobis est eligendi optio cumque nihil impedit quo minus id quod maxime placeat facere possimus."